codigo,titulo,autor,descricao,preco,link_livro,link_pdf,link_epub,tem_versao_imprimivel
bagps,Muchachos y muchachas que jugarán,J. C. Ryle,"Muchachos y muchachas que jugarán describe el cuidado de Dios por los niños en términos atractivos y fáciles de entender para un niño. Partiendo del hecho de que en la Jerusalén restaurada “las calles de la ciudad estarán llenas de muchachos y muchachas que jugarán” (Zacarías 8:5), Ryle asegura a los pequeños que Dios piensa en los niños y las niñas y les permite jugar. Luego, les insta a que recuerden los ojos y los oídos de Dios, mantengan su temperamento, no descuiden el trabajo debido al juego y recuerden que la verdadera felicidad no proviene de los placeres inocentes del juego, sino solo de Cristo.",0.26,https://www.chapellibrary.org/book/bagps/,https://www.chapellibrary.org/api/books/download?code=bagps&format=pdf,https://www.chapellibrary.org/api/books/download?code=bagps&format=epub,SIM
tdaus,La hija del maestro: el amor dominante de Jesús,William Reid,"Mary Ann Whyte era la hija de un maestro en Inverness-shire, quien murió hace poco tiempo regocijándose en Jesucristo, a la temprana edad de diecisiete años y seis meses.",0.35,https://www.chapellibrary.org/book/tdaus/,https://www.chapellibrary.org/api/books/download?code=tdaus&format=pdf,https://www.chapellibrary.org/api/books/download?code=tdaus&format=epub,SIM
gojas,"Dios de Jacob, El",Arthur W. Pink,"Este título divino —“El Dios de Jacob”— se encuentra, al menos, catorce veces en el Antiguo Testamento y, además, tres veces leemos sobre “El poderoso Dios de Jacob”. Esta repetición frecuente contiene un significado profundo y sugiere valiosas lecciones para aprender. Nunca leemos sobre el Dios de Moisés, el Dios de Josué o el Dios de Salomón. Entonces, ¿por qué Dios se ha identificado a sí mismo con Jacob? ¿Qué hay en el trato del Señor con este hombre que nos sugiere la importancia de este título? ¿Cuál es el significado particular de esta expresión que aparece y se repite a través de los Salmos como un estribillo familiar?",0.52,https://www.chapellibrary.org/book/gojas/,https://www.chapellibrary.org/api/books/download?code=gojas&format=pdf,https://www.chapellibrary.org/api/books/download?code=gojas&format=epub,SIM
tcoms,"Diez Mandamientos, Los",Arthur W. Pink,"""Hay dos cosas que son indispensables para la vida del cristiano: un conocimiento claro del deber y una práctica consciente del mismo correspondiente a su conocimiento. Así como no podemos tener una esperanza bien fundada de la salvación eterna sin la obediencia, tampoco podemos tener una regla segura de la obediencia sin el conocimiento. Aunque puede haber conocimiento sin práctica, no es posible que haya práctica de la voluntad de Dios sin conocimiento. Y, por lo tanto, para que seamos informados de lo que debemos hacer y lo que debemos evitar, al Gobernante y Juez de toda la tierra le ha agradado prescribirnos leyes para regular nuestras acciones. Cuando habíamos desfigurado miserablemente la Ley de la naturaleza originalmente escrita en nuestro corazón de modo que muchos de sus mandamientos ya no eran legibles, le pareció bien al Señor transcribir esa Ley en las Escrituras, y en los Diez Mandamientos tenemos un resumen de los mismos.""",1.78,https://www.chapellibrary.org/book/tcoms/,https://www.chapellibrary.org/api/books/download?code=tcoms&format=pdf,https://www.chapellibrary.org/api/books/download?code=tcoms&format=epub,SIM
wtpas,Una palabra para los padres,Arthur W. Pink,"""Una de las características más tristes y trágicas de nuestra 'civilización' del siglo XX es la terrible prevalencia de desobediencia de los hijos hacia sus padres durante los días de la niñez, y su falta de reverencia y respeto cuando crecen. Esto se evidencia de muchas maneras, y es general, lamentablemente, incluso en las familias de los que profesan ser cristianos. En sus extensos viajes durante los últimos treinta años, el escritor ha residido en un gran número de hogares: la piedad y la belleza de algunos de ellos siguen siendo recuerdos sagrados y fragantes, pero otros de ellos han dejado las impresiones más dolorosas. Los hijos que son obstinados o mimados no solo se conducen a sí mismos a la infelicidad perpetua, sino que infligen incomodidad a todos los que tienen contacto con ellos, y anuncian cosas malas para los días venideros.""",0.17,https://www.chapellibrary.org/book/wtpas/,https://www.chapellibrary.org/api/books/download?code=wtpas&format=pdf,,SIM
contfgs,Contentamiento,Autor Desconhecido,.,1.78,https://www.chapellibrary.org/book/contfgs/,https://www.chapellibrary.org/api/books/download?code=contfgs&format=pdf,https://www.chapellibrary.org/api/books/download?code=contfgs&format=epub,SIM
pwors,Adoración pública,J. C. Ryle,"En una época en que a menudo se considera a la adoración en términos de cómo beneficia al adorador o como lo hace sentir, las instrucciones y exhortaciones de Ryle llegan como un llamado esencial de devolver a la adoración centrada en Dios. La adoración pública es para Dios. Tenemos que adorar de una manera que coincide con la Palabra de Dios y tomar en cuenta las partes de la adoración que las Escrituras nos instan emplear. Hay errores que evitar en lo respecta a la adoración. Y hay también pruebas cruciales a las cuales someter nuestra adoración para ayudarnos a discernir si estamos adorando correctamente a Dios.",1.10,https://www.chapellibrary.org/book/pwors/,https://www.chapellibrary.org/api/books/download?code=pwors&format=pdf,https://www.chapellibrary.org/api/books/download?code=pwors&format=epub,SIM
elyhs,Ocho mentiras que oyes,Richard Ochs,en la universidad y en el mundo,0.17,https://www.chapellibrary.org/book/elyhs/,https://www.chapellibrary.org/api/books/download?code=elyhs&format=pdf,,SIM
incafgs,Encarnación,Autor Desconhecido,"En este número de Portavoz sobre Encarnación, J. C. Ryle da una explicación provechosa, clara y bíblica de lo fundamental en cuanto a la encarnación de Cristo. John Flavel nos ofrece luego un vislumbre extraordinario de la gloria de Cristo antes de su encarnación; la gloria y relación de amor que tenía con su Padre celestial antes de que comenzara el mundo. Demasiados cristianos en la actualidad piensan en la Encarnación solo en términos del niñito en el pesebre, sin relacionarlo con el propósito eterno de Dios—sus consultas y decretos. A. W. Pink nos ayuda a vencer esa miopía. Mientras estamos en el tema de la preencarnación de Cristo, Lorraine Boettner nos da una provechosa reseña de ciertos pasajes que enfocan la existencia de Cristo antes del tiempo: Jesús hizo muy claro el hecho de que su existencia no comenzó sencillamente cuando nació en Belén. Y Belén pequeña fue el punto preciso en que el propósito eterno de redención de Dios se convirtió en una realidad histórica. Horatius Bonar nos dice que “Belén es donde comienza la historia”. ¿Lo creemos? Thomas Boston nos ayuda a entender el nacimiento de Cristo: la concepción virginal, la santificación de la naturaleza humana de Cristo, la unión de la humanidad con la Deidad en la persona de Cristo y por qué Jesús tenía que nacer de una virgen. La doctrina gloriosa de la Encarnación se va desplegando a medida que William S. Plumer describe el evento más grande que jamás sucedió; Dios se hizo hombre. Con un segundo artículo John Flavel explica la humillación necesaria del Hijo eterno de Dios —su naturaleza, niveles y duración— mostrándonos que tenía que ser grandemente humillado antes de ser grandemente exaltado. Charles Spurgeon nos da la última palabra. Explica que en el Dios-hombre podemos ver todos los atributos de Dios. Pero quiere que nos enfoquemos en esta gloriosa visualización: ¡Jesús estaba lleno de gracia y de verdad!",1.78,https://www.chapellibrary.org/book/incafgs/,https://www.chapellibrary.org/api/books/download?code=incafgs&format=pdf,https://www.chapellibrary.org/api/books/download?code=incafgs&format=epub,SIM
tfypfgs,Pensamientos para los jóvenes,Autor Desconhecido,"En este número del Portavoz de la Gracia, Archibald Alexander presenta nuestro tema con un excelente consejo bíblico para los jóvenes. Plantea una importante colección de pensamientos desde la necesidad de un carácter consistente hasta la preparación para la muerte. Después de esto, J. C. Ryle da otra colección de exhortaciones reflexivas y provocativas, enfocándose en la necesidad de una persona joven de entender el pecado, el Salvador, la oración y la Palabra de Dios, además de ser cautelosos en la elección de amigos. John Angell James advierte a los jóvenes acerca de los pecados de su época, que no son diferentes de los pecados de los jóvenes de nuestros días. El apóstol Pablo instruyó a Tito a exhortar a los jóvenes a ser sobrios (Tito 2:6). A la luz de esto, Matthew Henry brinda persuasiones bíblicas, aleccionadoras y alentadoras para que los hombres y mujeres jóvenes cultiven la sobriedad. ¿Qué casa puede soportar peleas constantes entre hermanos y hermanas? ¿Cómo deben tratarse los hermanos? John Angell James brinda una discusión útil sobre este asunto. El puritano Tomás Vicente exhorta con fervor a los jóvenes que profesan la fe en Cristo a ser firmes y no desviarse. Explica sabiamente los motivos y da instrucciones para evitar la declinación y la apostasía. Con una prédica característica centrada en Cristo, Charles Spurgeon exhorta a los jóvenes a que dejen de poner excusas y crean en Cristo Jesús para vida eterna.
 
Esta edición fue preparada en colaboración con Publicaciones Aquila. La traducción en español copyright ©2018 Publicaciones Aquila, North Bergen, NJ, EE.UU.; usado con permiso.",1.92,https://www.chapellibrary.org/book/tfypfgs/,https://www.chapellibrary.org/api/books/download?code=tfypfgs&format=pdf,https://www.chapellibrary.org/api/books/download?code=tfypfgs&format=epub,SIM
aopss,El ABC de las Escrituras proféticas,George H. Clement,"El ABC de las Escrituras proféticas
 compara las enseñanzas del dispensacionalismo con las Escrituras. Demuestra que Dios tiene un reino glorioso, prefigurado en Israel, revelado en la iglesia y cumplido en la edad eterna por venir. Argumenta que la iglesia de Jesucristo es el Israel espiritual de Dios; que la segunda venida de Cristo será un evento que marcará el fin del mundo; y que la Tribulación, el Milenio y el Anticristo son todos representativos de eventos que ya han comenzado a cumplirse en la experiencia de la iglesia, pero que aún pueden tener que alcanzar su clímax antes del regreso de Cristo.",1.78,https://www.chapellibrary.org/book/aopss/,https://www.chapellibrary.org/api/books/download?code=aopss&format=pdf,https://www.chapellibrary.org/api/books/download?code=aopss&format=epub,SIM
medifgs,Meditación,Autor Desconhecido,"Presentamos este número de 
Portavoz de la Gracia
 sobre Meditación.  Coincidimos con los pastores, teólogos y autores ya mencionados: la meditación es esencial a un andar saludable con Cristo y para crecer en la gracia. Con eso, Charles Spurgeon presenta este tema con una vista panorámica provechosa sobre la importancia, la práctica y los beneficios de la meditación bíblica. Thomas Watson define lo que es. Thomas Manton tiene la convicción de que es un deber bíblico y nos dice por qué. ¿En qué radica la naturaleza de la meditación? Isaac Ambrose responde y describe el tiempo, lugar y tema de esta práctica santa. William Bates nos instruye hermosamente en la meditación ocasional enfocada en la creación de Dios y George Swinnock ofrece cinco descripciones de la solemne y deliberada meditación sobre temas sagrados. ¿Existen peligros reales en descuidar este acto santo de pensar profundamente? ¡Edmund Calamy lista doce! Y son aleccionadores. John Owen, pastor y teólogo profundamente espiritual, nos presenta ayudas prácticas para meditar en Dios y luego A.W. Pink nos muestra meticulosamente como encarar un texto bíblico para poder masticar el Pan de Vida. ¿Es la meditación algo nuevo para usted y se pregunta sobre qué meditar? En un segundo artículo, Thomas Watson presenta un hermoso panorama de temas bíblicos a los cuales dedicarnos de corazón, empezando por Dios en la eternidad, avanzando a Cristo en la historia y extendiéndose al cielo e infierno. Después, Jonathan Edwards nos insta a demostrar nuestro amor por Cristo, lo hace dándonos una bella descripción de su hermosura. Spurgeon, gran defensor y practicante de la meditación, concluye este número instruyéndonos con dulces meditaciones sobre Jesucristo nuestro Señor. ¡Y qué preciosas son! De hecho, le instamos a meditar en el contenido de este número de Portavoz.  Una advertencia: le meditación es difícil en nuestro mundo demasiado ocupado y despreocupado, pero este Portavoz es una breve guía de cómo hacerlo que rogamos encienda su corazón para buscar la gloria de Cristo en las Escrituras y para amarle que nunca.",1.78,https://www.chapellibrary.org/book/medifgs/,https://www.chapellibrary.org/api/books/download?code=medifgs&format=pdf,https://www.chapellibrary.org/api/books/download?code=medifgs&format=epub,SIM
aposfgs,Apostasía,Autor Desconhecido,"Ofrecemos este número de 
Portavoz de la Gracia
 para ayudarnos a evaluar nuestro propio estado espiritual.A. W. Pink presenta el tema de la apostasía y la define bíblicamente. Charles Spurgeon nos da muchas razones por las cuales algunos abandonan a Cristo. Ebenezer Erskine nos ayuda a ver la diferencia entre una apostasía parcial y una total. Siempre aparece Hebreos 6:4-6 cuando surge el tema de apostasía. Pink nos da una exposición clara y provechosa de este importante pasaje. En un segundo artículo, Erskine nos enfrenta con lo vil de la apostasía y ofrece aliento para ayudarnos a evitarla. En un sermón realmente penetrante, Samuel Pierce enfoca a los que se apartan de las iglesias de Cristo. Thomas Brooks describe siete características de maestros apóstatas con el fin de ayudarnos a identificarlos y evitarlos. Pueden ser individuos los que se apartan, pero también pueden hacerlo iglesias enteras. Horatius Bonar nos ayuda a reconocer a las iglesias que están haciendo un naufragio de la fe. John Owen pone bien en claro que los pastores juegan un papel vital en ayudar al pueblo de Cristo a evitar la apostasía. Por último, Gardiner Spring nos refresca con la gran provisión de Dios para preservar a sus hijos de la caída final y fatal.",1.78,https://www.chapellibrary.org/book/aposfgs/,https://www.chapellibrary.org/api/books/download?code=aposfgs&format=pdf,https://www.chapellibrary.org/api/books/download?code=aposfgs&format=epub,SIM
resufgs,Resurrección,Autor Desconhecido,"Ofrecemos este último tomo de 
Portavoz de la Gracia—Resurrección
. El pueblo de Dios necesita que esta bendita y alentadora verdad llegue a sus corazones. Es realmente alimento para el alma hambrienta del creyente. Charles Spurgeon abre el camino enseñándonos la importancia de la resurrección como una verdad del evangelio. Incluso en sus tiempos muchos estaban desviando o distorsionando esa doctrina esencial. J. C. Ryle destaca el gran contraste entre el hecho de la resurrección y la 
lentitud
 de los discípulos en creerla. Albert N. Martin luego nos presenta cuatro verdades acerca de la resurrección de Cristo de entre los muertos que magnifica su gloria y esplendor. ¿Cuáles son las evidencias de la resurrección de nuestro Señor? William S. Plumer las examina y nos la detalla, y luego Thomas Manton describe los numerosos beneficios que los creyentes reciben de él: ¡qué impresionante cofre del tesoro! George Whitefield, poderoso predicador del Gran Despertar, explica el poder de la resurrección en el alma del cristiano, y David Martyn Lloyd-Jones demuestra la conexión crucial entre la resurrección de Cristo y la vida diaria del creyente. Para terminar, Charles Spurgeon tiene la última palabra sobre este tema glorioso: ¡nos dice que Cristo fue el primero en resucitar y que por eso, la resurrección del creyente está garantizada! ¡Alabemos el nombre del Señor!
Jesucristo murió en la cruz del Calvario y resucitó para salvar a su pueblo de la pena, el placer, el poder y algún día de la presencia del pecado. Amados hijos de Dios, que este número de 
Portavoz de la Gracia
 avive el fuego de su amor por la resurrección del Señor de gloria y llene sus corazones de un gozo inefable y pleno de gloria. Que nuestra predicación y nuestro evangelio incluyan siempre la verdad eterna y transformadora que cambió toda la historia humana: “¡Ciertamente el Señor ha resucitado!” Servimos a un Salvador resucitado.",1.78,https://www.chapellibrary.org/book/resufgs/,https://www.chapellibrary.org/api/books/download?code=resufgs&format=pdf,https://www.chapellibrary.org/api/books/download?code=resufgs&format=epub,SIM
pihos,Perseverancia en santidad,Carlos Spurgeon,En el mundo hay hombres y mujeres con quienes Dios sostiene una relación de pacto. Esas personas firmantes del pacto pueden ser reconocidas por ciertas marcas y evidencias. Esas personas son reconocidas por tener el temor de Dios en sus corazones.,0.61,https://www.chapellibrary.org/book/pihos/,https://www.chapellibrary.org/api/books/download?code=pihos&format=pdf,https://www.chapellibrary.org/api/books/download?code=pihos&format=epub,SIM
tiogs,"Verdadero Israel de Dios, El","Lee Roy Shelton, Jr.","El verdadero Israel de Dios
 explora la verdad bíblica de que todos los creyentes, hijos de Dios por el nuevo nacimiento, son el verdadero Israel de Dios. Ellos son el pueblo escogido de Dios sobre la tierra hoy. Son los herederos actuales de las promesas hechas a Abraham y su simiente en Cristo. Nuestro Señor Jesucristo está reinando como Rey de reyes y Señor de señores. Él ya se sienta en el trono de David en los lugares celestiales. Las santas promesas de Dios a Israel se están cumpliendo.",1.51,https://www.chapellibrary.org/book/tiogs/,https://www.chapellibrary.org/api/books/download?code=tiogs&format=pdf,https://www.chapellibrary.org/api/books/download?code=tiogs&format=epub,SIM
lafos,Perdido y encontrado,Arthur W. Pink,"""¡Cuántas multitudes de personas hay que no se preocupan por su lamentable condición, de hecho, no tienen conciencia de ello! Aunque no se consideran perfectos, no son conscientes de que hay algo seriamente malo en ellos. Son personas respetables, ciudadanos respetuosos de la ley y nada en particular perturba su conciencia. Consideran que ciertamente no son peores que sus vecinos religiosos; y aunque casi nunca leen la Biblia o entran en una iglesia, esperan ir al cielo cuando mueran. Algunos de ellos admitirán que son pecadores, pero imaginan que sus buenas obras superan en gran número a las malas. Una clase más pequeña de ellos fueron rociados con agua cuando eran bebés, asistieron a una clase bíblica cuando eran niños, rezaron sus oraciones cada noche y luego se unieron a la iglesia; sin embargo, hasta este momento, nunca se han dado cuenta de que son enemigos de Dios y que son una abominación ante los ojos de Su santidad y que el infierno es su justo baldío.""",0.43,https://www.chapellibrary.org/book/lafos/,https://www.chapellibrary.org/api/books/download?code=lafos&format=pdf,https://www.chapellibrary.org/api/books/download?code=lafos&format=epub,SIM
gpefs,La profecía más extraordinaria jamás cumplida,"Lee Roy Shelton, Jr.","""Con la ayuda del Espíritu Santo, consideraremos «La profecía más extraordinaria jamás cumplida», basada en Daniel 9:20-27.
 
""Mi oración es que nuestro bondadoso Señor, por medio de Su Espíritu, abra los ojos de nuestro entendimiento para darnos luz y conocimiento sobre esta bendita porción de Su Palabra, que trata de la «bondad y la severidad de Dios» (Ro 11:22). Habla de la bondad de Dios porque en ella tenemos la gran profecía concerniente a la obra de nuestro Señor Jesucristo, al traer la gracia y la misericordia de Dios a Su pueblo por medio de Su obra sustitutiva en la cruz. Y expone la severidad de Dios contra los pecados de la nación judía en aquel momento, al rechazar y crucificar al Señor de la gloria.
 
""La Escritura que contiene esta profecía es una de las más maravillosas e importantes de la Palabra de Dios. En esta porción es de supremo interés la medida de tiempo registrada divinamente, que comienza con el regreso de los israelitas del cautiverio babilónico, hasta el evento culminante de toda la profecía y toda la historia: hasta la llegada del «Mesías» y Su crucifixión.""",1.64,https://www.chapellibrary.org/book/gpefs/,https://www.chapellibrary.org/api/books/download?code=gpefs&format=pdf,https://www.chapellibrary.org/api/books/download?code=gpefs&format=epub,SIM
hotgs,El corazón del evangelio,Carlos Spurgeon,"""La redención es el corazón del Evangelio, y la esencia de la redención es el sacrificio sustitutivo de Cristo. Los que predican esta verdad predican el Evangelio, aun si se equivocaran en alguna otra cosa; pero los que no predican la expiación, sin que importe lo que digan, no han podido captar el alma y la sustancia del mensaje divino.""",0.61,https://www.chapellibrary.org/book/hotgs/,https://www.chapellibrary.org/api/books/download?code=hotgs&format=pdf,https://www.chapellibrary.org/api/books/download?code=hotgs&format=epub,SIM
gwors,Adoración evangélica,Jeremiah Burroughs,"Al Lector:	Nuestro propósito en este Prefacio no es hablar del valor eminente del Autor, cuya memoria es bendecida en los corazones de todos los piadosos de esta Nación; o de este Fragmento mismo aquí publicado: sino solo para asegurarte que es suyo. Y aunque no alcanzan la exactitud y perfección que podría haber en ellos si él mismo los hubiera publicado.	Sin embargo, con esa concesión diferente que se ha de dar: notas tomadas de su boca en la Predicación ordinaria y frecuente, no dudamos sino, que, en su uso y beneficio, pueden ser tan provechosas para los Santos como otros de sus Escritos, siendo tan útiles, llenos de materiales de peso y divinos, habiendo permitido que la impronta del Espíritu y el lenguaje de este Hombre santo (uno de los más grandes predicadores de esta época) se muestre todo el tiempo sobre ellos.	A nosotros (para quienes, este hermano nuestro, era muy querido y precioso) se nos ha confiado la publicación de sus Sermones, y hemos pensado primero en dar paso a estos pocos, que si reciben la bienvenida que merecen, muchas otras excelentes obras suyas podrían poco después aparecer a la vista del público.	Los puntos tratados en estos sermones son de gran interés y, por lo tanto, concebimos que el autor, aunque al manejarlos tuvo suficiente espacio para discutir muchas de las controversias de la época, sin embargo, las dejó deliberadamente, y se inclinó a la única entrega de lo que más tendía a la edificación y mejor se adaptaba a un auditorio tan popular como aquél, al cual hablaba. El Señor del cielo os bendiga para vuestro beneficio espiritual, y os capacite por medios como estos para santificar su Nombre en el uso de todas sus Ordenanzas, que es el deseo de:Thomas Goodwin,William Greenhill,William Bridge,Sydrach SimpsonPhilip Nye.(Todos ellos miembros dela asamblea de Westminster)",,https://www.chapellibrary.org/book/gwors/,https://www.chapellibrary.org/api/books/download?code=gwors&format=pdf,https://www.chapellibrary.org/api/books/download?code=gwors&format=epub,NÃO
stles,Buscad al Señor temprano,J. C. Ryle,"¡Es bueno ser amado! Queremos ser amados por las personas importantes en nuestras vidas. Pero un amor es más grande que los demás: el amor del Señor Jesucristo, el Hijo de Dios, por Su pueblo. ¡Oh, cómo los ama! Vivió para su beneficio. Él sufrió para asegurar su salvación. ¡Él resucitó como su eterno Rey y Salvador! ¿Conoces Su amor? Él llama a todos a buscarlo a Él y a su amor. ¿Lo conoces? En este folleto, J. C. Ryle insta a los niños a comprender y creer en el amor de Cristo, y a buscar una relación viva con Él.",0.52,https://www.chapellibrary.org/book/stles/,https://www.chapellibrary.org/api/books/download?code=stles&format=pdf,https://www.chapellibrary.org/api/books/download?code=stles&format=epub,SIM
