codigo,titulo,autor,descricao,preco,link_livro,link_pdf,link_epub,tem_versao_imprimivel
tfyms,Pensamientos para hombres jóvenes,J. C. Ryle,"Reflexiones para los hombres jóvenes
: “Cuando San Pablo escribió su Epístola a Tito acerca de su deber como ministro, mencionó a los jóvenes como una clase que requiere atención especial. Después de hablar de hombres ancianos y mujeres ancianas, y de mujeres jóvenes, agrega este consejo conciso: ""Exhorta asimismo a los jóvenes a que sean prudentes"" (Tit. 2: 6). Voy a seguir el consejo del apóstol. Propongo ofrecer algunas palabras de exhortación amistosa a los jóvenes. “Yo también estoy envejeciendo, pero hay pocas cosas que recuerdo tan bien como los días de mi juventud. Recuerdo claramente las alegrías y las tristezas, las esperanzas y los miedos, las tentaciones y las dificultades, los juicios equivocados y los afectos equivocados, los errores y las aspiraciones que rodean y acompañan la vida de un joven. Si solo puedo decir algo para mantener a un joven en el camino correcto y preservarlo de las faltas y los pecados, lo que puede arruinar sus perspectivas tanto en el tiempo como en la eternidad, estaré muy agradecido "". —J. C. Ryle",1.64,https://www.chapellibrary.org/book/tfyms/,https://www.chapellibrary.org/api/books/download?code=tfyms&format=pdf,https://www.chapellibrary.org/api/books/download?code=tfyms&format=epub,SIM
pochfgs,Persona de Cristo,Autor Desconhecido,.,1.78,https://www.chapellibrary.org/book/pochfgs/,https://www.chapellibrary.org/api/books/download?code=pochfgs&format=pdf,https://www.chapellibrary.org/api/books/download?code=pochfgs&format=epub,SIM
wawss,¿Por qué somos salvos por medio de la fe?,Carlos Spurgeon,"¿Por qué es la fe el medio escogido para la salvación? Sin duda surge esta pregunta con frecuencia. “Por gracia sois salvos por medio de la fe” es por cierto una de las doctrinas de las Sagradas Escrituras y el plan de Dios; pero ¿por qué es así? ¿Por qué escogió la fe y no más bien la esperanza, el amor o la paciencia? Nos conviene responder a esta pregunta con humildad, porque los caminos de Dios no son siempre comprensibles, ni nos permite él ponerlos, arrogantemente, en telas de juicio.",0.14,https://www.chapellibrary.org/book/wawss/,https://www.chapellibrary.org/api/books/download?code=wawss&format=pdf,,SIM
pepes,"Profesión expuesta, Posesión explicada","Lee Roy Shelton, Jr.","Buscando mensajes predicados sobre la verdadera conversión. Nunca ha habido un día en la historia de la iglesia cuando aparentemente ha habido más mención y menos práctica de la piedad de lo que se ha visto en nuestras iglesias hoy en día. ¿Dónde está la piedad y santidad vitales que caracterizaron a la iglesia en los Hechos de los Apóstoles? ¿Dónde está el fruto del Espíritu, el amor por las almas y una crucifixión para el mundo? La verdadera conversión da como resultado una vida cambiada, un camino santo y un amor por Dios.",1.10,https://www.chapellibrary.org/book/pepes/,https://www.chapellibrary.org/api/books/download?code=pepes&format=pdf,https://www.chapellibrary.org/api/books/download?code=pepes&format=epub,SIM
ltjes,Puestos sus ojos en Jesús,William Reid,"Puestos sus hojos en Jesús
 lleva al alumno al Salvador de los pecadores, a Jesús de Nazaret, al Hijo del hombre y al Hijo de Dios. ¿Eres un pecador? No encontrarás seguridad en una religión centrada en ti y en tus buenas obras. . Asuma la responsabilidad personal por su pecado y acérquese a Dios por medio de Jesús el Salvador para obtener el perdón y la bendición. Jesús murió como sustituto de su pueblo pecador, y Dios está satisfecho con el precio que pagó Su Hijo. Habiendo resucitado triunfalmente de la tumba y habiendose sentado como el Rey a la diestra del Padre, ¡Él ahora te llama a abandonar tus pecados y tus propios esfuerzos para salvarte y confiar completamente en Él como tu Salvador, tu Señor, tu Vida!",1.37,https://www.chapellibrary.org/book/ltjes/,https://www.chapellibrary.org/api/books/download?code=ltjes&format=pdf,https://www.chapellibrary.org/api/books/download?code=ltjes&format=epub,SIM
rwsws,Razones por las cuales algunos no vendrán a Cristo,Albert N. Martin,"“Y no queréis venir a mí para que tengáis vida.”
 
¡Seguramente éstas son unas de las palabras más trágicas que jamás se hayan dicho! Con ellas Jesús asevera claramente que la vida habría de encontrarse en Él, y que se obtendría sencillamente viniendo a Él. No estaba hablando de vida física, sino de la vida espiritual y eterna que uno recibe al unirse a Él por medio de la fe. Sin embargo, sus oyentes rehusaron hacer la única cosa necesaria para obtener la vida eterna, ya que rehusaron creer en Él. Y las palabras sobrias de Jesús demuestran que Él los considera a ellos —y a todos los que son como ellos— responsables por su indisposición obstinada de venir a Él.
 
¿Qué fue lo que impidió que estas personas externamente religiosas vinieran a Cristo? ¿Qué te impide a ti, mi amigo inconverso, venir a Cristo hoy? Al bosquejar cuatro de las razones principales por las que algunos no vendrán a Cristo, espero persuadirte a que abandones estas razones y que vengas a Jesucristo.",0.43,https://www.chapellibrary.org/book/rwsws/,https://www.chapellibrary.org/api/books/download?code=rwsws&format=pdf,https://www.chapellibrary.org/api/books/download?code=rwsws&format=epub,SIM
wians,Razones por las cuales no soy Catalico Romano,Charles B. LaFevre,.,0.17,https://www.chapellibrary.org/book/wians/,https://www.chapellibrary.org/api/books/download?code=wians&format=pdf,,SIM
rmgns,Reconciliación: La mayor necesidad del hombre,"Lee Roy Shelton, Jr.","Reconciliación: la necesidad más grande del hombre
 profundiza en la raíz del problema real de la humanidad, la alienación de Dios a causa del pecado y su cura, la reconciliación a través de la obra de Cristo.",0.68,https://www.chapellibrary.org/book/rmgns/,https://www.chapellibrary.org/api/books/download?code=rmgns&format=pdf,https://www.chapellibrary.org/api/books/download?code=rmgns&format=epub,SIM
bregs,"Regeneración bautismal, La",Carlos Spurgeon,"Contenido:
Introducción
I.  El bautismo sin fe no salva a nadie.
II.  La fe es el requisito indispensable para la salvación.
III.  El bautismo en el texto está evidentemente vinculado con la fe.",0.87,https://www.chapellibrary.org/book/bregs/,https://www.chapellibrary.org/api/books/download?code=bregs&format=pdf,https://www.chapellibrary.org/api/books/download?code=bregs&format=epub,SIM
dregs,Regeneración decisional,James Adams,"La Regeneración Decisional
 ha permeado a gran parte de la Iglesia Cristiana de una manera engañosa. Al igual que la Regeneración Bautismal, ésta ve el nuevo nacimiento como el resultado de un proceso mecánico que realiza el hombre, ignorando la obra soberana de Dios al darles a los hombres nuevos corazones. La práctica de la Regeneración Decisional en la Iglesia debe ser expuesta, para salvar a los hombres de la condenada ilusión de que porque ""decidieron"" o ""firmaron una tarjeta"", van al cielo y ya no están bajo la ira de Dios. El propósito de este folleto no es cuestionar la sinceridad de algunos cristianos o difamarlos, sino unir a los cristianos en la verdad bíblica. Solo el evangelio es el poder de Dios para la salvación y la verdadera base de la unidad cristiana.",0.61,https://www.chapellibrary.org/book/dregs/,https://www.chapellibrary.org/api/books/download?code=dregs&format=pdf,https://www.chapellibrary.org/api/books/download?code=dregs&format=epub,SIM
tbcis,Revestirse de Cristo,Carlos Spurgeon,.,0.43,https://www.chapellibrary.org/book/tbcis/,https://www.chapellibrary.org/api/books/download?code=tbcis&format=pdf,https://www.chapellibrary.org/api/books/download?code=tbcis&format=epub,SIM
holis,Santidad,J. C. Ryle,"En 
Santidad
  (1879), J. C. Ryle muestra que el pueblo de Dios adquiere santidad cuando cree y obedece las Escrituras en su vida cotidiana. Explica el significado bíblico de “perfección”, el controversial capítulo siete de 
Romanos
, la doctrina del Cristo que permanece en nosotros, la relación entre consagración y conversión y la necesidad de que los  que quieren ser santos “velen, oren y luchen” . Al igual que los grandes pensadores puritanos, de quienes toma libremente sus enseñanzas, no ofrece ninguna manera fácil de alcanzar la vida cristiana en su expresión más elevada. Su anhelo a lo largo del libro es práctico y persistente: Que la santidad personal aumente grandemente entre el pueblo de Dios.",14.29,https://www.chapellibrary.org/book/holis/,https://www.chapellibrary.org/api/books/download?code=holis&format=pdf,https://www.chapellibrary.org/api/books/download?code=holis&format=epub,SIM
sancs,Santificación,J. C. Ryle,"De acuerdo con JC Ryle, la santificación no es opcional, como algunos creen, sino absolutamente necesaria porque si no somos santificados, ""no seremos salvos"". El continúa dandonos una definición detallada de la santificación al expandirse en las 12 declaraciones con bases bíblicas mencionadas debajo. La santificación es: 1) el resultado de nuestra unión con Cristo, 2) una consecuencia de la regeneración, 3) evidencia real del Espíritu residente, 4) una marca segura de la elección de Dios, 5) algo que siempre se verá, 6) algo de lo cual todo creyente es responsable, 7) algo que crece, 8) algo que depende del uso diligente de los medios bíblicos, 9) algo que no lo exime a uno del conflicto espiritual interno, 10) algo que no puede justificar un hombre, sin embargo, agrada a Dios, 11) algo que será absolutamente necesario en el Juicio Final, y 12) algo que se requiere para prepararnos para el cielo.",0.43,https://www.chapellibrary.org/book/sancs/,https://www.chapellibrary.org/api/books/download?code=sancs&format=pdf,https://www.chapellibrary.org/api/books/download?code=sancs&format=epub,SIM
sde2s,Los engaños de Satanás,W. A. Mason,"Una breve descripción de los planes, trucos y complots de Satanás para destruir al pueblo de Dios. Nuestro Rey y Salvador Jesucristo ha triunfado y mostrará Su gloriosa victoria sobre Satanás por toda la eternidad.",0.09,https://www.chapellibrary.org/book/sde2s/,https://www.chapellibrary.org/api/books/download?code=sde2s&format=pdf,,SIM
lasas,Señor y Salvador,Arthur W. Pink,"El mensaje del evangelio predicado hoy a menudo omite el simple hecho de que la salvación es del ""Señor"". Los pecadores no solo necesitan un ""Salvador personal""; deben deponer las armas de su rebelión y someterse a Él como Señor. En este tratado, A W Pink nos llama a reconsiderar una visión superficial del evangelio y a mantener el orden correcto: Cristo es nuestro 
Señor
 y Salvador.",0.17,https://www.chapellibrary.org/book/lasas/,https://www.chapellibrary.org/api/books/download?code=lasas&format=pdf,https://www.chapellibrary.org/api/books/download?code=lasas&format=epub,SIM
swors,Sonidos de adoración,Scott Aniol,"Sonidos de adoración
 se trata de tomar decisiones musicales. Pero no cualquier tipo de decisiones. Este es un libro sobre tomar decisiones musicales deliberadamente fundamentadas en la Palabra de Dios. Se trata de elegir aquella música que refleje discernimiento y sabiduría, y que sea beneficiosa y edificante. Este libro se trata de tomar decisiones musicales que glorifiquen a Dios.",2.33,https://www.chapellibrary.org/book/swors/,https://www.chapellibrary.org/api/books/download?code=swors&format=pdf,https://www.chapellibrary.org/api/books/download?code=swors&format=epub,SIM
saums,Supongamos que un hombre pudiese ir al cielo sin santidad,J. C. Ryle,"Supongamos por un momento que se te permitió entrar al cielo sin santidad. ¿Qué harías? ¿Qué disfrute podrías encontrar allí? ¿Y qué tendrías en común con los santos de Dios? Seguramente sus placeres no son tus placeres y sus gustos no son tus gustos. Con esto, J. C. Ryle comienza este pequeño tratado. Continúa considerando las preferencias del lector: tal vez te guste la compañía de los mundanos, los que buscan placer y los profanos. No habrá tales personas en el cielo. Quizás pienses que los creyentes son demasiado estrictos y serios y prefieren evitarlos. Estas serán las únicas personas en el cielo. Ryle recuerda la Escritura: “Sin santidad nadie verá al Señor”.",0.09,https://www.chapellibrary.org/book/saums/,https://www.chapellibrary.org/api/books/download?code=saums&format=pdf,,SIM
subsfgs,Sustitución,Autor Desconhecido,"En el corazón del bendito mensaje del Evangelio de la Biblia se encuentran los temas del pecado, la muerte, la santidad de Dios, la justicia, la ira y el sacrificio de sustitución de Jesucristo. Por eso Pablo escribió: ""Cristo murió por nuestros pecados según las Escrituras"" (1Co 15: 3). Charles Spurgeon presenta este glorioso tema de la sustitución, que proclama el corazón del Evangelio. Arthur Pink nos instruye con respecto al aspecto del pacto de la obra sustitutiva de Cristo. Spurgeon entonces explica magistralmente el Gran Intercambio: el pecado y la culpa del pecador creyente que se impone a Cristo; la justicia de Cristo sobre los pecadores creyentes. Pink luego explica con cuidado cómo la sustitución de Cristo es una obra penal. Octavius Winslow revela cómo la sangrienta sustitución de Cristo logró un perdón completo para su pueblo. Acumulando una Escritura sobre otra, John Owen nos da un estupendo esquema y resumen de la revelación bíblica del sacrificio y la sustitución. Finalmente, Jonathan Edwards engrandece la sabiduría de Dios en la obra vicaria de Cristo.",1.78,https://www.chapellibrary.org/book/subsfgs/,https://www.chapellibrary.org/api/books/download?code=subsfgs&format=pdf,https://www.chapellibrary.org/api/books/download?code=subsfgs&format=epub,SIM
tbbas,Tienes que nacer de nuevo,Anonymous,"¿Ha recibido usted al Hijo de Dios como su Salvador? ¿Ha creído usted que Jesús es el Cristo? Si así lo a hecho, usted a nacido de Dios. El conocimiento de ésto viene a través de creer en la Palabra de Dios, el sello al recibir el Espíritu Santo, y la evidencia se manifestara en la conducta. Haga la prueba por ésto. La eternidad está a la mano. El cielo y el infierno están en la balanza. Os es necesario nacer de nuevo.",0.05,https://www.chapellibrary.org/book/tbbas/,https://www.chapellibrary.org/api/books/download?code=tbbas&format=pdf,,SIM
aogrs,Totalmente por gracia,Carlos Spurgeon,"Acerca de 
Toda la Gracia
: “El objetivo de este libro es la salvación del lector. El que lo habló y lo escribió se sentirá enormemente decepcionado si no lleva a muchos al Señor Jesús. Este libro se presenta en dependencia similar a la de un niño del poder de Dios el Espíritu Santo, para usarlo en la conversión de millones, si así El lo desea ... Lector, ¿te interesa la lectura de estas páginas? Si es así, estamos de acuerdo desde el principio; pero nada menos que tu búsqueda de Cristo y el cielo es la meta que se dirige aquí. ¡Oh, que podamos buscar esto juntos! Lo hago dedicando este pequeño libro en oración. ¿No te unirás a mí mirando a Dios y pidiéndole que te bendiga mientras lees? ”- C.H. Spurgeon, del Capítulo Uno.",3.67,https://www.chapellibrary.org/book/aogrs/,https://www.chapellibrary.org/api/books/download?code=aogrs&format=pdf,https://www.chapellibrary.org/api/books/download?code=aogrs&format=epub,SIM
jgods,Un Dios Justo,Carlos Spurgeon,"En este tratado, Charles Spurgeon usa su propia vida como ejemplo para explicar la expiación de Cristo. Cuando estaba convencido de pecado, Spurgeon agonizaba preguntandose: ""Cómo Dios puede ser justo y, sin embargo, justificarme a mí mismo por haber sido tan culpable"". Explica en detalle la respuesta que recibió por fe; en esencia: ""El que es el Hijo de Dios se hizo hombre y, en su propia persona bendecida, llevó mi pecado en su propio cuerpo en el madero"". Continúa mostrando lo que es confiar en Jesús para la salvación y concluye con las palabras de consuelo: “Si tienes al Señor Jesús, Él ya te tiene a ti. Si crees en Él, te digo que no puedes ir al infierno, porque eso haría el sacrificio perfecto de Cristo sin efecto.",0.09,https://www.chapellibrary.org/book/jgods/,https://www.chapellibrary.org/api/books/download?code=jgods&format=pdf,,SIM
ggfgs,Un gran evangelio para grandes pecadores,Carlos Spurgeon,.,0.69,https://www.chapellibrary.org/book/ggfgs/,https://www.chapellibrary.org/api/books/download?code=ggfgs&format=pdf,https://www.chapellibrary.org/api/books/download?code=ggfgs&format=epub,SIM
stogs,Un soldado cuenta su experiencia de gracia,Autor Desconhecido,.,0.17,https://www.chapellibrary.org/book/stogs/,,,SIM
ayw2s,Una cita que cumplirás,Joel Beeke,"Es muy posible que tú y yo no nos conocemos y que nunca nos conoceremos. No obstante, quiero escribirte una carta personal.
Te escribo porque tenemos más en común de lo que piensas. Aunque nunca nos encontremos en este mundo, un día nos veremos porque ambos tenemos un alma que nunca muere. Con esta alma, ambos habremos de comparecer ante Dios, tu Creador y el mío, en aquel gran día del juicio. “Está establecido para los hombres que mueran una sola vez, y después de esto el juicio” (Hebreo 9:27).",0.17,https://www.chapellibrary.org/book/ayw2s/,,,SIM
doc2s,Una defensa al calvinismo,Carlos Spurgeon,"En este sermón, Charles Spurgeon (1834-1892) defiende las doctrinas comúnmente llamadas, “Calvinistas”. “Yo tengo mi propia opinión particular que no hay tal cosa como predicar a Cristo y a Él crucificado, a menos que prediquemos lo que hoy en día se llama la doctrina calvinista. El calvinismo no es otra cosa que el Evangelio. No creo que podamos predicar el Evangelio si no predicamos la justificación por la fe, sin obras; ni a menos que prediquemos la soberanía de Dios en Su dispensación de la Gracia; ni a menos que exaltemos el amor que elige y que no se puede cambiar, eterno, inmutable y conquistador de Jehová. Tampoco pienso que podamos predicar el Evangelio a menos que lo basemos sobre la redención especial y particular de Su pueblo escogido y elegido, que Cristo llevó a cabo en la cruz. Tampoco puedo comprender un Evangelio que permite que los santos se aparten de manera definitiva después de haber sido llamados y deja que los hijos de Dios se quemen en los fuegos de la condenación después de haber creído una vez en Jesús. Yo aborrezco un Evangelio así.”",0.61,https://www.chapellibrary.org/book/doc2s/,https://www.chapellibrary.org/api/books/download?code=doc2s&format=pdf,https://www.chapellibrary.org/api/books/download?code=doc2s&format=epub,SIM
hwgms,Una hora con George Mueller,Sims,"Una entrevista con George Mueller de Bristol. ""Me recibió con un cordial saludo y me dio la bienvenida. Una cosa es meramente ver a un hombre por el cual Dios ha realizado una gran obra: es más escuchar los tonos de su voz; pero mucho mayor que cualquiera de ellas es el privilegio de estar en contacto inmediato con su espíritu y de sentir el cálido aliento de su alma respirado en el propio. La comunión de esa hora quedará grabada en mi memoria mientras la vida durará. Este siervo del Altísimo me abrió su corazón, me aconsejó, oró conmigo y me dio su bendición. En esa hora, la fuente de la gran fuerza espiritual de George Mueller se manifestó claramente. El anciano santo con todas sus facultades intactas, fue elocuente todo el tiempo sobre un tema, la alabanza de Jehová, el gran oyente y el que responde a las oraciones de su pueblo. Mis propias palabras fueron pocas. ""¿Siempre ha encontrado al Señor fiel a Su promesa, Sr. Mueller? ""¡Siempre! ¡Nunca me ha fallado! ...",0.69,https://www.chapellibrary.org/book/hwgms/,https://www.chapellibrary.org/api/books/download?code=hwgms&format=pdf,https://www.chapellibrary.org/api/books/download?code=hwgms&format=epub,SIM
braas,Una mala historia personal y un corazón malo,Albert N. Martin,"Un registro malo y un corazón malo contemplan el desafío que enfrenta cada persona en la tierra: aquel que merece el juicio de Dios y no puede hacer lo que Dios requiere. Con el corazón de pastor, el autor explica cuidadosamente cómo esto es así, y desafía a todos a correr al Señor Jesucristo como la única respuesta a su extrema necesidad.",0.35,https://www.chapellibrary.org/book/braas/,https://www.chapellibrary.org/api/books/download?code=braas&format=pdf,https://www.chapellibrary.org/api/books/download?code=braas&format=epub,SIM
ncres,Una nueva creación,Arthur W. Pink,La salvación transforma la vida de una persona.,0.06,https://www.chapellibrary.org/book/ncres/,https://www.chapellibrary.org/api/books/download?code=ncres&format=pdf,,SIM
pfhes,Una oración desde el infierno,Holmes Moore,"Tomando la historia de nuestro Salvador sobre el hombre rico y Lázaro, el pastor Moore ofrece una descripción general de la oración del hombre rico dividida en tres partes, y extrae lecciones para nosotros de cada una.
Primero, las 
circunstancias
 de esta oración sirven para instruirnos. El rico oró cuando vio el reino de Dios; oró fervientemente por un sentimiento de necesidad y en gran agonía, pero oró demasiado tarde.
En segundo lugar, las 
peticiones
 de esta oración están destinadas a nuestra corrección. Oró a la persona equivocada, preguntó por el libertador equivocado y buscó el agua equivocada.
En tercer lugar, la 
respuesta burlona
 a esta oración es para nuestra solemne advertencia. Abraham lo llamó ""hijo"", le pidió ""que recuerde"" y ""que considere lo que se ha perdido"". Finalmente, se le dice que el infierno es para siempre. Y este terrible hecho se burlará eternamente de sus habitantes.",0.14,https://www.chapellibrary.org/book/pfhes/,https://www.chapellibrary.org/api/books/download?code=pfhes&format=pdf,,SIM
wttis,Una Palabra Al Impenitente,John Colquhoun,.,0.06,https://www.chapellibrary.org/book/wttis/,https://www.chapellibrary.org/api/books/download?code=wttis&format=pdf,,SIM
ctchs,Viniendo a Cristo,Thomas Wilcox,"Ven a Mí, dijo nuestro Salvador. Thomas Willcox llama a todos los pecadores a Jesucristo para la salvación solo a través de la fe.",0.09,https://www.chapellibrary.org/book/ctchs/,https://www.chapellibrary.org/api/books/download?code=ctchs&format=pdf,,SIM
efpws,Palabras de aliento para esposas de pastores,Albert N. Martin,"Esta es una exhortación viva y oportuna para las mujeres que a menudo experimentan más presiones y estrés en sus vidas diarias que la mayoría de los cristianos. En el estilo comprobado del pastor Al Martin, le dice al lector al principio: ""Es la Palabra de Dios la que marca el camino de lo que debería ser la esposa de un pastor, cómo debe cumplir los roles y responsabilidades que Dios le ha dado"". las ideas se basan en las Escrituras y de hecho sorprenderán y alentarán a la esposa del pastor en su andar único, con su esposo y con su Dios.",1.92,https://www.chapellibrary.org/book/efpws/,https://www.chapellibrary.org/api/books/download?code=efpws&format=pdf,,SIM
cstgs,Niños: busquen al Buen Pastor,Robert Murray M'Cheyne,"Niños: busquen al Buen Pastor
 presenta el evangelio sencillo a los jóvenes. McCheyne describe el rebaño de Cristo, el buen Pastor, y nos habla del trabajo y cuidado del Pastor a sus corderos.",0.35,https://www.chapellibrary.org/book/cstgs/,https://www.chapellibrary.org/api/books/download?code=cstgs&format=pdf,https://www.chapellibrary.org/api/books/download?code=cstgs&format=epub,SIM
salos,"Escrituras y el amor, Las",Arthur W. Pink,"Contenido
Introducción
1. La gran importancia del amor cristiano
2. Las distorsiones del amor cristiano
3. La verdadera naturaleza del amor cristiano
4. La comunicación divina del amor cristiano
5. La práctica del amor cristiano
6. Las manifestaciones variadas del amor cristiano
7. La manera apropiada de cultivar el amor cristiano",0.43,https://www.chapellibrary.org/book/salos/,,,SIM
sagws,"Escrituras y las buenas obras, Las",Arthur W. Pink,"Contenido
Dos precipicios peligrosos
1. El verdadero lugar de las buenas obras
2. La absoluta necesidad de las buenas obras
3. El designio de las buenas obras
4. La verdadera naturaleza de las buenas obras
5. La verdadera fuente de nuestras buenas obras
6. La gran importancia de las buenas obras
7. El verdadero alcance de las buenas obras",0.43,https://www.chapellibrary.org/book/sagws/,,,SIM
sajos,"Escrituras y el gozo, Las",Arthur W. Pink,"Contenido
Introducción
1. El deber de gozar
2. El secreto del verdadero gozo
3. El gran valor del gozo
4. La raíz del gozo
5. El mantenimiento del gozo
6. Los obstáculos al gozo
7. El equilibrio entre el gozo y la pena",0.43,https://www.chapellibrary.org/book/sajos/,,,SIM
saobs,"Escrituras y la obediencia, Las",Arthur W. Pink,"Contenido
La importancia de la obediencia
1. Aprender lo que Dios exige
2. Entender como ha fallado completamente
3. Aprender lo que Dios ha provisto
4. Tener amor por sus mandamientos
5. Entregarse a todos los mandamientos
6. Orar para gracia para obedecer
7. Disfrutar del premio de la obediencia",0.43,https://www.chapellibrary.org/book/saobs/,,,SIM
satws,"Escrituras y el mundo, Las",Arthur W. Pink,"Contenido
Introducción
1. Discernir el verdadero carácter del mundo
2. Aprender que el mundo es un enemigo
3. Aprender que Cristo murió para librarnos del mundo
4. Ser destetado del mundo
5. Caminar separado del mundo
6. Provocar el aborrecimiento
7. Elevarse por encima del mundo",0.35,https://www.chapellibrary.org/book/satws/,,,SIM
